<?xml version="1.0" encoding="UTF-8"?>
<!DOCTYPE directory PUBLIC
  "-//Penrose/DTD Directory ${product.specification}//EN"
  "http://penrose.safehaus.org/dtd/directory.dtd">

<directory>

  <entry dn="dc=MySQL,dc=Example,dc=com">
    <oc>dcObject</oc>
    <oc>organization</oc>
    <at name="dc" rdn="true">
      <constant>MySQL</constant>
    </at>
    <at name="o">
      <constant>MySQL</constant>
    </at>
    <aci subject="self">
      <permission>rws</permission>
    </aci>
    <aci>
      <target>ATTRIBUTES</target>
      <attributes>userPassword</attributes>
      <action>deny</action>
      <permission>rs</permission>
    </aci>
    <aci>
      <permission>rs</permission>
    </aci>
  </entry>

  <entry dn="ou=Users,dc=MySQL,dc=Example,dc=com">
    <oc>organizationalUnit</oc>
    <at name="ou" rdn="true">
      <constant>Users</constant>
    </at>
  </entry>

  <entry dn="uid=...,ou=Users,dc=MySQL,dc=Example,dc=com">
    <entry-class>org.safehaus.penrose.directory.DynamicEntry</entry-class>
    <oc>person</oc>
    <oc>organizationalPerson</oc>
    <oc>inetOrgPerson</oc>
    <at name="uid" rdn="true">
      <variable>u.username</variable>
    </at>
    <at name="cn">
      <expression>
if (u == void || u == null) return null;
return u.firstName+" "+u.lastName;
      </expression>
    </at>
    <at name="sn">
      <variable>u.lastName</variable>
    </at>
    <at name="userPassword">
      <variable>u.password</variable>
    </at>
    <source alias="u">
      <source-name>users</source-name>
      <field name="username">
        <variable>uid</variable>
      </field>
      <field name="firstName">
        <expression>
if (cn == void || cn == null) return null;
int i = cn.lastIndexOf(" ");
if (i &lt; 0) return null;
return cn.substring(0, i);
        </expression>
      </field>
      <field name="lastName">
        <expression>
if (sn != void &amp;&amp; sn != null) return sn;
if (cn == void || cn == null) return null;
int i = cn.lastIndexOf(" ");
if (i &lt; 0) return cn;
return cn.substring(i+1);
        </expression>
      </field>
      <field name="password">
        <variable>userPassword</variable>
      </field>
    </source>
  </entry>

  <entry dn="ou=Groups,dc=MySQL,dc=Example,dc=com">
    <oc>organizationalUnit</oc>
    <at name="ou" rdn="true">
      <constant>Groups</constant>
    </at>
  </entry>

  <entry dn="cn=...,ou=Groups,dc=MySQL,dc=Example,dc=com">
    <entry-class>org.safehaus.penrose.directory.DynamicEntry</entry-class>
    <oc>groupOfUniqueNames</oc>
    <at name="cn" rdn="true">
      <variable>g.groupname</variable>
    </at>
    <at name="description">
      <variable>g.description</variable>
    </at>
    <source alias="g">
      <source-name>groups</source-name>
      <field name="groupname">
        <variable>cn</variable>
      </field>
      <field name="description">
        <variable>description</variable>
      </field>
    </source>
  </entry>

</directory>
